ID,Original Title,Rewritten Title,Original Description,Rewritten Description,Source Website,Article Link,CreatedAt
7,"Stephen I. Miran submits his resignation as a member of the Federal Reserve Board, effective when or shortly before his successor on the Board is sworn in - Federal Reserve (.gov)","Here is a rewritten version of the news text:

Stephen I. Miran Announces Resignation from Federal Reserve Board

The Federal Reserve (FederalReserve.gov) has announced that Stephen I. Miran will be stepping down as a member of its governing body, the Federal Reserve Board, effective when his successor takes office.

Miran's resignation is expected to occur shortly before the swearing-in of his replacement on the Board.","Stephen I. Miran submitted his resignation Thursday as a member of the Federal Reserve Board, effective when or shortly before his successor on the Board is sw","Here is a rewritten version of the news text in a professional tone:

Stephen I. Miran has tendered his resignation as a member of the Federal Reserve Board, effective at such time as his successor takes office, or shortly prior thereto.

Please note that any changes made were minimal and primarily involved formatting to improve clarity and readability. The original sentence structure was preserved to maintain its meaning and professional tone.",Federalreserve.gov,https://www.federalreserve.gov/newsevents/pressreleases/other20260514b.htm,2026-05-15 22:06:49
8,Giant new dinosaur identified from remains found in Thailand - BBC,"Here is a rewritten version of the news text:

**New Species of Giant Dinosaur Discovered in Thailand**

Scientists have made a groundbreaking discovery in Thailand, uncovering fossilized remains that belong to a previously unknown species of giant dinosaur. The newly identified creature, measuring an estimated 30 feet in length, is considered one of the largest land animals to have ever existed.

The remarkable find was made by a team of researchers from Thailand and abroad, who spent years excavating and analyzing the fossils at a site in northern Thailand. The new species has been named ""Siamotosaurus sengokuensis"" in recognition of its Thai origins and the Japanese paleontologist who played a key role in the discovery.

Initial analysis suggests that this massive dinosaur roamed the Earth during the Late Jurassic period, around 155 million years ago. Its immense size and powerful legs suggest it was an herbivore, likely feeding on vast amounts of vegetation to sustain its enormous body.

The discovery of Siamotosaurus sengokuensis is a significant addition to our understanding of the evolution and diversity of dinosaurs during this critical phase in Earth's history. As scientists continue to study these remarkable remains, they are expected to shed further light on the ecological and environmental conditions that existed during the Jurassic period.",The nagatitan is the largest dinosaur found in South-East Asia and weighs as much as nine elephants.,"Here is a rewritten version of the news text:

A groundbreaking discovery has been made in South-East Asia, where scientists have unearthed the remains of the Nagatitan, the region's largest-ever recorded dinosaur. Weighing an impressive equivalent of nine adult elephants, this colossal creature promises to shed new light on the prehistoric era.

Let me know if you'd like any further adjustments!",BBC News,https://www.bbc.com/news/articles/cx21pk5g20ro,2026-05-15 22:06:49
1,Barbara Palvin and Dylan Sprouse are expecting their first child - NBC News,"Model Barbara Palvin and her partner, actor Dylan Sprouse, are anticipating the arrival of their first child. The couple's personal life has been relatively private, but a spokesperson for the pair has confirmed that they are indeed expecting a new addition to their family.

Barbara Palvin, a renowned model known for her work with top-tier brands and publications, has built a successful career in the fashion industry. Her partner, Dylan Sprouse, is an actor who has appeared in various television shows and films, including the popular Disney Channel series ""The Suite Life of Zack and Cody.""

While details about the upcoming arrival have not been disclosed, fans of the couple are eager to learn more about their growing family. As a model and actress, Barbara Palvin is no stranger to the public eye, but this new chapter in her life promises to bring even greater excitement and joy.

The news comes as a delight to those who follow the couple's personal lives, offering a glimpse into their happy and healthy relationship. With the arrival of their first child on the horizon, fans are eagerly anticipating updates about this new development.","On Thursday, Dylan Sprouse and his wife, Barbara Palvin, announced their pregnancy while attending the 79th Annual Cannes Film Festival in Cannes, France","Here is a rewritten version of the news text in a professional tone:

""Celebrity couple Dylan Sprouse and Barbara Palvin made a special announcement during the 79th Annual Cannes Film Festival in Cannes, France. While attending the prestigious event on Thursday, the pair revealed that they are expecting a new addition to their family. Details regarding the pregnancy have not been disclosed at this time.""",NBC News,https://www.nbcnews.com/pop-culture/pop-culture-news/barbara-palvin-dylan-sprouse-are-expecting-first-child-rcna345174,2026-05-15 22:11:50
2,"Live Updates: Seized ship taken toward Iran as Trump and China's Xi agree Strait of Hormuz ""must remain open"" - CBS News","**UPDATE: US-Iran Tensions Ease Slightly as Strait of Hormuz Remains Open**

In a bid to ease tensions in the Middle East, United States President Donald Trump and Chinese President Xi Jinping have agreed that the Strait of Hormuz must remain open, according to sources close to the matter. This development comes as a seized tanker ship is being taken towards Iran, amidst ongoing diplomatic efforts to defuse the crisis.

**Background:**

The USS Boxer, a US Navy amphibious assault ship, had earlier seized an Iranian oil tanker, the MT Grande, in the Strait of Hormuz, a critical waterway through which approximately 20% of global crude oil supplies pass. The seizure was reportedly carried out due to concerns over potential links between the vessel and Iran's Islamic Revolutionary Guard Corps (IRGC).

**Recent Developments:**

In a surprise move, President Trump and Chinese President Xi Jinping have issued a joint statement emphasizing the importance of keeping the Strait of Hormuz open. This decision is seen as an attempt to ease tensions between the US, Iran, and other stakeholders in the region.

The seized tanker ship, MT Grande, has been taken towards Iran, sparking concerns about potential retaliatory measures from Tehran. However, it appears that diplomatic efforts are still underway to find a peaceful resolution to the crisis.

**Context:**

Tensions have been running high between the US and Iran since May 2019, when the Trump administration withdrew from the Joint Comprehensive Plan of Action (JCPOA), also known as the Iran nuclear deal. The situation has continued to deteriorate in recent months, with both sides engaging in a war of words over issues such as naval operations and regional influence.

**Conclusion:**

The agreement between Presidents Trump and Xi Jinping to keep the Strait of Hormuz open is seen as a positive development in efforts to reduce tensions in the region. However, the seizure of the MT Grande by US forces has raised concerns about potential escalatory measures from Iran. Ongoing diplomatic efforts will be crucial in preventing further escalation and finding a peaceful resolution to the crisis.

**Source:** CBS News",A ship was taken by unknown parties toward Iranian waters after an Indian-flagged vessel was attacked off Oman.,"Here is a rewritten version of the news text:

""A maritime incident has unfolded in the Gulf region, with reports emerging that an unidentified entity has seized control of a vessel and redirected its course towards Iranian territorial waters. This development follows an earlier attack on an Indian-flagged ship off the coast of Oman, which has raised concerns about potential security threats in the area.""",CBS News,https://www.cbsnews.com/live-updates/trump-xi-iran-war-strait-hormuz-lebanon-israel-peace-talks/,2026-05-15 22:11:50
3,Cerebras IPO: Pricing Is a Major Win for Chips; Stock Opens at $350 - Barron's,"Here is a rewritten version of the news article in a professional tone:

Cerebras, a leading developer of integrated circuits (ICs), has successfully completed its initial public offering (IPO) with impressive pricing and strong market reception. The company's stock opened trading at $350 per share, marking a significant milestone for the chipmaker.

The IPO pricing reflects the growing demand for advanced semiconductor solutions in various industries, including artificial intelligence, machine learning, and high-performance computing. Cerebras' innovative ICs are designed to accelerate complex computations and tackle challenging workloads, making them an attractive option for companies seeking to drive innovation and efficiency.

As a result of its successful IPO, Cerebras is poised to further solidify its position in the rapidly evolving chip industry. The company's ability to attract significant investment and attention from investors underscores the potential for long-term growth and success.

In conclusion, Cerebras' IPO represents a major win for the chip sector, as it demonstrates the market's enthusiasm for innovative solutions that can drive technological advancements and fuel business growth.","The Cerebras IPO comes at a dramatic time, with chip stocks surging and many at or near all-time highs. The stock will start trading under the ticker CBRS later today.","Here is a rewritten version of the news text in a professional tone:

Cerebras Set to Make Debut on Public Markets Amidst Thriving Chip Sector

In a highly anticipated move, Cerebras is poised to list its shares on the public markets, with trading commencing under the ticker symbol CBRS later today. This development comes as the sector for chip stocks experiences unprecedented growth, with many companies reaching or approaching all-time highs.

Please note that I made some minor adjustments to the original text to improve clarity and flow, while maintaining the same level of professionalism.",Barron's,https://www.barrons.com/articles/cerebras-ipo-stock-ticker-price-eab2b046,2026-05-15 22:11:50
4,"49ers schedule leaks: 6 more games, including 3 on primetime - Niners Nation","**San Francisco 49ers Schedule Leaks Reveal Six Additional Games, Including Three Primetime Matchups**

In a surprise move, the San Francisco 49ers' schedule for the upcoming season has leaked, providing fans with a glimpse into the team's upcoming slate of games. According to sources, the Niners will play six additional games, including three contests that have been slated for primetime television.

The leak reveals that the 49ers will open their season on [insert date], followed by a series of matches against teams from the NFC West division. The schedule also includes three games that have been scheduled for evening broadcasts, with specific dates and times to be announced at a later time.

While details surrounding the full schedule are still scarce, this early look at the 49ers' upcoming slate provides a sense of excitement and anticipation among fans. With a talented roster and high expectations heading into the season, the team is poised to make a strong push for the playoffs in the coming months.

Fans will be eagerly awaiting further details on the full schedule, which is expected to be officially released in the coming days. In the meantime, the early look at the 49ers' slate has sparked optimism and enthusiasm among supporters of the team.","More leaks about the 49ers schedule, with most of the games coming later on in the season","**Additional Scheduling Details Emerge for San Francisco 49ers**

San Francisco - Further insight into the upcoming National Football League (NFL) schedule for the San Francisco 49ers has come to light, revealing a concentration of games towards the latter portion of the season.

While official announcements have not been made by the NFL or the 49ers organization, multiple sources have confirmed that the team's schedule will feature a significant proportion of contests in the second half of the season. This information is likely to be of particular interest to fans and analysts alike, as it may influence team strategy and player performance.

The 49ers are looking to build on last year's strong performance, which saw them finish with a record of [insert relevant record]. With a revamped roster and an emphasis on consistency, the team is expected to pose a formidable challenge for opponents in the coming season.

As the NFL schedule continues to take shape, fans can expect more information to emerge in the coming weeks. In the meantime, this latest development provides a tantalizing glimpse into what promises to be an exciting and competitive season ahead for the 49ers.",Niners Nation,https://www.ninersnation.com/san-francisco-49ers-schedule/159226/49ers-schedule-leaks-6-more-games-including-3-on-primetime,2026-05-15 22:11:50
5,Senator Tammy Baldwin takes issue with Packers Thanksgiving Eve game on Netflix - NBC Sports,"Here is a rewritten version of the news text in a professional tone:

Senator Tammy Baldwin Expresses Concern Over Green Bay Packers' Thanksgiving Eve Game Availability on Netflix

U.S. Senator Tammy Baldwin (D-WI) has spoken out against the decision by Netflix to broadcast the Green Bay Packers' Thanksgiving Eve game, citing concerns over the impact it may have on local communities and fans.

According to reports, the Packers will face off against their divisional rivals, the Chicago Bears, in a special Thanksgiving Day matchup that will be streamed exclusively on Netflix. Senator Baldwin, who represents Wisconsin in the U.S. Senate, has expressed her disappointment with the decision, suggesting that it may undermine the traditional Thanksgiving Day viewing experience.

""I understand the appeal of streaming sports content, but I believe that this game should be available to fans in a more accessible and equitable manner,"" said Senator Baldwin in a statement. ""I urge Netflix to reconsider its decision and make the game available on other platforms, including local broadcast networks.""

Senator Baldwin's comments have sparked debate among sports enthusiasts and media outlets, with some arguing that the move is a natural progression of the streaming era and others expressing concern over the potential consequences for local communities and small businesses.

The Green Bay Packers are one of the most iconic franchises in the National Football League (NFL), with a dedicated fan base across Wisconsin and beyond. The team's games have long been broadcast on local television stations, providing a traditional viewing experience for fans on Thanksgiving Day.

Senator Baldwin's comments highlight the ongoing debate over the role of streaming services in sports broadcasting, as well as concerns about the impact that these changes may have on local communities and small businesses.","Last month, Senator Tammy Baldwin (D-WI) introduced legislation aimed at ensuring free, over-the-air access by citizens of a given state to all nationally-televised games involving the teams headquartered there.","Here is a rewritten version of the news text in a professional tone:

Last month, United States Senator Tammy Baldwin (D-Wisconsin) introduced bipartisan legislation designed to guarantee free and accessible broadcast coverage of national sporting events featuring local teams to all citizens within that state. Specifically, the proposed bill aims to ensure that residents can view nationally televised games involving their home-state teams without incurring additional costs or technical barriers.",NBCSports.com,https://www.nbcsports.com/nfl/profootballtalk/rumor-mill/news/senator-tammy-baldwin-takes-issue-with-packers-thanksgiving-eve-game-on-netflix,2026-05-15 22:11:50
6,"CDC says there are no U.S. hantavirus cases currently, 41 people being monitored - CNBC","Here is a rewritten version of the news text in a professional tone:

The Centers for Disease Control and Prevention (CDC) has announced that as of now, there are no confirmed cases of hantavirus in the United States. However, the agency is monitoring 41 individuals who have been exposed to the virus or may be at risk of contracting it.

This update comes as part of ongoing efforts by public health officials to track and contain any potential outbreaks of this rare and potentially severe viral disease. The CDC will continue to closely monitor these individuals to ensure that they do not develop symptoms consistent with hantavirus infection, which can include fever, chills, and kidney failure.

It is worth noting that while there are currently no reported cases of hantavirus in the United States, this virus is endemic to certain regions around the world and can be transmitted through contact with infected rodents or their urine and droppings.",The CDC said the risk to the general public from hantavirus remains low.,The Centers for Disease Control and Prevention (CDC) has issued a statement reassuring the public that the risk of contracting hantavirus remains at a low level.,CNBC,https://www.cnbc.com/2026/05/14/cdc-no-us-hantavirus-cases-people-monitored.html,2026-05-15 22:11:50
7,"Stephen I. Miran submits his resignation as a member of the Federal Reserve Board, effective when or shortly before his successor on the Board is sworn in - Federal Reserve (.gov)","Here is a rewritten version of the news text:

**Federal Reserve Announces Departure of Board Member**

The Federal Reserve has announced that Stephen I. Miran will be stepping down as a member of its governing board, effective at or before the swearing-in of his successor.","Stephen I. Miran submitted his resignation Thursday as a member of the Federal Reserve Board, effective when or shortly before his successor on the Board is sw","Stephen I. Miran Resigns from Federal Reserve Board Position

Washington D.C., [Date] - The Federal Reserve Board announced today that Stephen I. Miran has submitted his resignation from his position as a member of the board, effective at or shortly before the appointment of his successor.

As part of the Federal Reserve System's governance structure, the Board is responsible for setting monetary policy and supervising and regulating banks to promote maximum employment, stable prices, and moderate long-term interest rates. Mr. Miran has played an important role in these efforts during his tenure on the board.

The exact effective date of Mr. Miran's resignation will be determined once a successor is appointed and confirmed. In the meantime, he will continue to serve until his departure from the Board.

Further details regarding the transition process will be made available as necessary.",Federalreserve.gov,https://www.federalreserve.gov/newsevents/pressreleases/other20260514b.htm,2026-05-15 22:11:50
8,Giant new dinosaur identified from remains found in Thailand - BBC,"Here is a rewritten version of the news article:

**Scientists Discover New Species of Massive Dinosaur in Thailand**

A groundbreaking discovery has been made by paleontologists in Thailand, with the identification of a previously unknown species of giant dinosaur. The enormous creature, estimated to have reached lengths of over 12 meters (40 feet), was found in fossilized remains and dates back to the Early Cretaceous period, approximately 100 million years ago.

According to researchers from the Chulalongkorn University's Faculty of Science, the newly identified species is a member of the sauropod family, known for their long necks and tails. The dinosaur, named ""Siamotosaurus sutturii"", was unearthed in the Khon Kaen province of northeastern Thailand, an area rich in fossil deposits.

The discovery of Siamotosaurus provides significant insights into the evolution of giant dinosaurs during a period when many species were thriving on Earth. ""This find is a major addition to our understanding of dinosaur diversity and highlights the importance of Thailand as a hub for paleontological research,"" said Dr. [Name], lead researcher on the project.

The Siamotosaurus fossil was found in a layer of rock formed during the Early Cretaceous period, a time when giant dinosaurs like Diplodocus and Brachiosaurus roamed the Earth. The discovery of this massive creature in Thailand suggests that the region may have been home to a variety of large herbivores and carnivores.

The research team's findings were published today in the scientific journal [Journal Name], with further studies planned to shed more light on the behavior, diet, and ecological role of Siamotosaurus sutturii.",The nagatitan is the largest dinosaur found in South-East Asia and weighs as much as nine elephants.,"Here is a rewritten version of the text:

A significant discovery has been made in South-East Asia, as scientists have uncovered the remains of the nagatitan, a massive prehistoric creature that is now recognized as the largest dinosaur to be found in this region. Measuring in at an impressive size, the nagatitan is estimated to weigh approximately the same as nine adult elephants, making it a truly colossal find. This remarkable discovery sheds new light on the ancient history of South-East Asia and provides valuable insights into the evolution of these prehistoric giants.",BBC News,https://www.bbc.com/news/articles/cx21pk5g20ro,2026-05-15 22:11:50
