ID,Original Title,Rewritten Title,Original Description,Rewritten Description,Source Website,Article Link,CreatedAt
4,"49ers schedule leaks: 6 more games, including 3 on primetime - Niners Nation","49ers schedule leaks: 6 more games, including 3 on primetime - Niners Nation","More leaks about the 49ers schedule, with most of the games coming later on in the season","More leaks about the 49ers schedule, with most of the games coming later on in the season",Niners Nation,https://www.ninersnation.com/san-francisco-49ers-schedule/159226/49ers-schedule-leaks-6-more-games-including-3-on-primetime,2026-05-15 22:05:42
5,Senator Tammy Baldwin takes issue with Packers Thanksgiving Eve game on Netflix - NBC Sports,Senator Tammy Baldwin takes issue with Packers Thanksgiving Eve game on Netflix - NBC Sports,"Last month, Senator Tammy Baldwin (D-WI) introduced legislation aimed at ensuring free, over-the-air access by citizens of a given state to all nationally-televised games involving the teams headquartered there.","Last month, Senator Tammy Baldwin (D-WI) introduced legislation aimed at ensuring free, over-the-air access by citizens of a given state to all nationally-televised games involving the teams headquartered there.",NBCSports.com,https://www.nbcsports.com/nfl/profootballtalk/rumor-mill/news/senator-tammy-baldwin-takes-issue-with-packers-thanksgiving-eve-game-on-netflix,2026-05-15 22:05:42
6,"CDC says there are no U.S. hantavirus cases currently, 41 people being monitored - CNBC","CDC says there are no U.S. hantavirus cases currently, 41 people being monitored - CNBC",The CDC said the risk to the general public from hantavirus remains low.,The CDC said the risk to the general public from hantavirus remains low.,CNBC,https://www.cnbc.com/2026/05/14/cdc-no-us-hantavirus-cases-people-monitored.html,2026-05-15 22:05:42
7,"Stephen I. Miran submits his resignation as a member of the Federal Reserve Board, effective when or shortly before his successor on the Board is sworn in - Federal Reserve (.gov)","Stephen I. Miran submits his resignation as a member of the Federal Reserve Board, effective when or shortly before his successor on the Board is sworn in - Federal Reserve (.gov)","Stephen I. Miran submitted his resignation Thursday as a member of the Federal Reserve Board, effective when or shortly before his successor on the Board is sw","Stephen I. Miran submitted his resignation Thursday as a member of the Federal Reserve Board, effective when or shortly before his successor on the Board is sw",Federalreserve.gov,https://www.federalreserve.gov/newsevents/pressreleases/other20260514b.htm,2026-05-15 22:05:42
8,Giant new dinosaur identified from remains found in Thailand - BBC,Giant new dinosaur identified from remains found in Thailand - BBC,The nagatitan is the largest dinosaur found in South-East Asia and weighs as much as nine elephants.,The nagatitan is the largest dinosaur found in South-East Asia and weighs as much as nine elephants.,BBC News,https://www.bbc.com/news/articles/cx21pk5g20ro,2026-05-15 22:05:42
1,Barbara Palvin and Dylan Sprouse are expecting their first child - NBC News,Barbara Palvin and Dylan Sprouse are expecting their first child - NBC News,"On Thursday, Dylan Sprouse and his wife, Barbara Palvin, announced their pregnancy while attending the 79th Annual Cannes Film Festival in Cannes, France","On Thursday, Dylan Sprouse and his wife, Barbara Palvin, announced their pregnancy while attending the 79th Annual Cannes Film Festival in Cannes, France",NBC News,https://www.nbcnews.com/pop-culture/pop-culture-news/barbara-palvin-dylan-sprouse-are-expecting-first-child-rcna345174,2026-05-15 22:05:48
2,"Live Updates: Seized ship taken toward Iran as Trump and China's Xi agree Strait of Hormuz ""must remain open"" - CBS News","Live Updates: Seized ship taken toward Iran as Trump and China's Xi agree Strait of Hormuz ""must remain open"" - CBS News",A ship was taken by unknown parties toward Iranian waters after an Indian-flagged vessel was attacked off Oman.,A ship was taken by unknown parties toward Iranian waters after an Indian-flagged vessel was attacked off Oman.,CBS News,https://www.cbsnews.com/live-updates/trump-xi-iran-war-strait-hormuz-lebanon-israel-peace-talks/,2026-05-15 22:05:48
3,Cerebras IPO: Pricing Is a Major Win for Chips; Stock Opens at $350 - Barron's,Cerebras IPO: Pricing Is a Major Win for Chips; Stock Opens at $350 - Barron's,"The Cerebras IPO comes at a dramatic time, with chip stocks surging and many at or near all-time highs. The stock will start trading under the ticker CBRS later today.","The Cerebras IPO comes at a dramatic time, with chip stocks surging and many at or near all-time highs. The stock will start trading under the ticker CBRS later today.",Barron's,https://www.barrons.com/articles/cerebras-ipo-stock-ticker-price-eab2b046,2026-05-15 22:05:48
4,"49ers schedule leaks: 6 more games, including 3 on primetime - Niners Nation","49ers schedule leaks: 6 more games, including 3 on primetime - Niners Nation","More leaks about the 49ers schedule, with most of the games coming later on in the season","More leaks about the 49ers schedule, with most of the games coming later on in the season",Niners Nation,https://www.ninersnation.com/san-francisco-49ers-schedule/159226/49ers-schedule-leaks-6-more-games-including-3-on-primetime,2026-05-15 22:05:48
5,Senator Tammy Baldwin takes issue with Packers Thanksgiving Eve game on Netflix - NBC Sports,Senator Tammy Baldwin takes issue with Packers Thanksgiving Eve game on Netflix - NBC Sports,"Last month, Senator Tammy Baldwin (D-WI) introduced legislation aimed at ensuring free, over-the-air access by citizens of a given state to all nationally-televised games involving the teams headquartered there.","Last month, Senator Tammy Baldwin (D-WI) introduced legislation aimed at ensuring free, over-the-air access by citizens of a given state to all nationally-televised games involving the teams headquartered there.",NBCSports.com,https://www.nbcsports.com/nfl/profootballtalk/rumor-mill/news/senator-tammy-baldwin-takes-issue-with-packers-thanksgiving-eve-game-on-netflix,2026-05-15 22:05:48
6,"CDC says there are no U.S. hantavirus cases currently, 41 people being monitored - CNBC","CDC says there are no U.S. hantavirus cases currently, 41 people being monitored - CNBC",The CDC said the risk to the general public from hantavirus remains low.,The CDC said the risk to the general public from hantavirus remains low.,CNBC,https://www.cnbc.com/2026/05/14/cdc-no-us-hantavirus-cases-people-monitored.html,2026-05-15 22:05:48
7,"Stephen I. Miran submits his resignation as a member of the Federal Reserve Board, effective when or shortly before his successor on the Board is sworn in - Federal Reserve (.gov)","Stephen I. Miran submits his resignation as a member of the Federal Reserve Board, effective when or shortly before his successor on the Board is sworn in - Federal Reserve (.gov)","Stephen I. Miran submitted his resignation Thursday as a member of the Federal Reserve Board, effective when or shortly before his successor on the Board is sw","Stephen I. Miran submitted his resignation Thursday as a member of the Federal Reserve Board, effective when or shortly before his successor on the Board is sw",Federalreserve.gov,https://www.federalreserve.gov/newsevents/pressreleases/other20260514b.htm,2026-05-15 22:05:48
8,Giant new dinosaur identified from remains found in Thailand - BBC,Giant new dinosaur identified from remains found in Thailand - BBC,The nagatitan is the largest dinosaur found in South-East Asia and weighs as much as nine elephants.,The nagatitan is the largest dinosaur found in South-East Asia and weighs as much as nine elephants.,BBC News,https://www.bbc.com/news/articles/cx21pk5g20ro,2026-05-15 22:05:48
1,Barbara Palvin and Dylan Sprouse are expecting their first child - NBC News,Barbara Palvin and Dylan Sprouse are expecting their first child - NBC News,"On Thursday, Dylan Sprouse and his wife, Barbara Palvin, announced their pregnancy while attending the 79th Annual Cannes Film Festival in Cannes, France","On Thursday, Dylan Sprouse and his wife, Barbara Palvin, announced their pregnancy while attending the 79th Annual Cannes Film Festival in Cannes, France",NBC News,https://www.nbcnews.com/pop-culture/pop-culture-news/barbara-palvin-dylan-sprouse-are-expecting-first-child-rcna345174,2026-05-15 22:06:19
2,"Live Updates: Seized ship taken toward Iran as Trump and China's Xi agree Strait of Hormuz ""must remain open"" - CBS News","Live Updates: Seized ship taken toward Iran as Trump and China's Xi agree Strait of Hormuz ""must remain open"" - CBS News",A ship was taken by unknown parties toward Iranian waters after an Indian-flagged vessel was attacked off Oman.,A ship was taken by unknown parties toward Iranian waters after an Indian-flagged vessel was attacked off Oman.,CBS News,https://www.cbsnews.com/live-updates/trump-xi-iran-war-strait-hormuz-lebanon-israel-peace-talks/,2026-05-15 22:06:19
3,Cerebras IPO: Pricing Is a Major Win for Chips; Stock Opens at $350 - Barron's,Cerebras IPO: Pricing Is a Major Win for Chips; Stock Opens at $350 - Barron's,"The Cerebras IPO comes at a dramatic time, with chip stocks surging and many at or near all-time highs. The stock will start trading under the ticker CBRS later today.","The Cerebras IPO comes at a dramatic time, with chip stocks surging and many at or near all-time highs. The stock will start trading under the ticker CBRS later today.",Barron's,https://www.barrons.com/articles/cerebras-ipo-stock-ticker-price-eab2b046,2026-05-15 22:06:19
4,"49ers schedule leaks: 6 more games, including 3 on primetime - Niners Nation","49ers schedule leaks: 6 more games, including 3 on primetime - Niners Nation","More leaks about the 49ers schedule, with most of the games coming later on in the season","More leaks about the 49ers schedule, with most of the games coming later on in the season",Niners Nation,https://www.ninersnation.com/san-francisco-49ers-schedule/159226/49ers-schedule-leaks-6-more-games-including-3-on-primetime,2026-05-15 22:06:19
5,Senator Tammy Baldwin takes issue with Packers Thanksgiving Eve game on Netflix - NBC Sports,Senator Tammy Baldwin takes issue with Packers Thanksgiving Eve game on Netflix - NBC Sports,"Last month, Senator Tammy Baldwin (D-WI) introduced legislation aimed at ensuring free, over-the-air access by citizens of a given state to all nationally-televised games involving the teams headquartered there.","Last month, Senator Tammy Baldwin (D-WI) introduced legislation aimed at ensuring free, over-the-air access by citizens of a given state to all nationally-televised games involving the teams headquartered there.",NBCSports.com,https://www.nbcsports.com/nfl/profootballtalk/rumor-mill/news/senator-tammy-baldwin-takes-issue-with-packers-thanksgiving-eve-game-on-netflix,2026-05-15 22:06:19
6,"CDC says there are no U.S. hantavirus cases currently, 41 people being monitored - CNBC","CDC says there are no U.S. hantavirus cases currently, 41 people being monitored - CNBC",The CDC said the risk to the general public from hantavirus remains low.,The CDC said the risk to the general public from hantavirus remains low.,CNBC,https://www.cnbc.com/2026/05/14/cdc-no-us-hantavirus-cases-people-monitored.html,2026-05-15 22:06:19
7,"Stephen I. Miran submits his resignation as a member of the Federal Reserve Board, effective when or shortly before his successor on the Board is sworn in - Federal Reserve (.gov)","Stephen I. Miran submits his resignation as a member of the Federal Reserve Board, effective when or shortly before his successor on the Board is sworn in - Federal Reserve (.gov)","Stephen I. Miran submitted his resignation Thursday as a member of the Federal Reserve Board, effective when or shortly before his successor on the Board is sw","Stephen I. Miran submitted his resignation Thursday as a member of the Federal Reserve Board, effective when or shortly before his successor on the Board is sw",Federalreserve.gov,https://www.federalreserve.gov/newsevents/pressreleases/other20260514b.htm,2026-05-15 22:06:19
8,Giant new dinosaur identified from remains found in Thailand - BBC,Giant new dinosaur identified from remains found in Thailand - BBC,The nagatitan is the largest dinosaur found in South-East Asia and weighs as much as nine elephants.,The nagatitan is the largest dinosaur found in South-East Asia and weighs as much as nine elephants.,BBC News,https://www.bbc.com/news/articles/cx21pk5g20ro,2026-05-15 22:06:19
1,Barbara Palvin and Dylan Sprouse are expecting their first child - NBC News,"Renowned Model and Actor Couple, Barbara Palvin and Dylan Sprouse, Announce the Arrival of Their First Child.

Barbara Palvin, a Hungarian model and Victoria's Secret Angel, and Dylan Sprouse, an American actor best known for his roles in Disney Channel's ""The Suite Life of Zack and Cody"" and ""The Perks of Being a Wallflower"", have shared the joyous news that they are expecting their first child.

This is the couple's first pregnancy together. The pair has been dating since 2018 and have been busy with their respective careers while also enjoying each other's company.

As a model, Palvin has appeared on the covers of numerous fashion publications and has walked the runway for top designers during New York Fashion Week and Milan Fashion Week. Sprouse, on the other hand, has pursued an acting career in both television and film.

The couple has not yet revealed any details about their pregnancy, including the expected due date or the sex of their child. Fans and followers are eagerly awaiting further updates from the happy couple as they prepare for this exciting new chapter in their lives.

This news marks a significant milestone for Barbara Palvin and Dylan Sprouse, and fans around the world are sending their congratulations to the expecting parents.","On Thursday, Dylan Sprouse and his wife, Barbara Palvin, announced their pregnancy while attending the 79th Annual Cannes Film Festival in Cannes, France","Here is a rewritten version of the news text in a professional tone:

""Celebrity Couple Confirms Pregnancy at Cannes Film Festival

Actor Dylan Sprouse and his model spouse, Barbara Palvin, made a special announcement at the 79th Annual Cannes Film Festival in Cannes, France on Thursday. The couple, who tied the knot in 2018, revealed that they are expecting their first child together while attending the prestigious film event.",NBC News,https://www.nbcnews.com/pop-culture/pop-culture-news/barbara-palvin-dylan-sprouse-are-expecting-first-child-rcna345174,2026-05-15 22:06:49
2,"Live Updates: Seized ship taken toward Iran as Trump and China's Xi agree Strait of Hormuz ""must remain open"" - CBS News","Here is a rewritten version of the news text in a professional tone:

**Breaking Developments:** United States and China Reach Consensus on Strait of Hormuz, Amid Ongoing Tensions

Washington D.C. - In a significant development, US President Donald Trump and Chinese leader Xi Jinping have agreed that the Strait of Hormuz must remain open to international shipping, amidst ongoing tensions surrounding the seized Iranian tanker.

According to reports, the seized ship has been taken in the direction of Iran, sparking concerns about the potential consequences for global trade. The Strait of Hormuz, a vital waterway connecting the Persian Gulf to the Arabian Sea, is a crucial route for oil exports and global commerce.

In a joint statement issued following their meeting, Trump and Xi reaffirmed their commitment to maintaining the freedom of navigation in the Strait of Hormuz, a position that has been echoed by other nations concerned about the potential consequences of restrictions on maritime trade.

The seizure of the Iranian tanker has heightened tensions between Iran and the international community, with many nations calling for the safe release of the vessel and its crew. The development is seen as a key test of global commitment to maintaining free and open shipping lanes in the face of emerging conflicts.

Further updates will be provided as more information becomes available.",A ship was taken by unknown parties toward Iranian waters after an Indian-flagged vessel was attacked off Oman.,"Here is a rewritten version of the news text in a professional tone:

A mysterious incident has unfolded in the Gulf region, as reports emerged that an unidentified ship had been hijacked and directed towards Iranian territorial waters following an assault on an Indian-flagged vessel operating in Omani waters.

The exact circumstances surrounding the attack and subsequent hijacking remain unclear at this time.",CBS News,https://www.cbsnews.com/live-updates/trump-xi-iran-war-strait-hormuz-lebanon-israel-peace-talks/,2026-05-15 22:06:49
3,Cerebras IPO: Pricing Is a Major Win for Chips; Stock Opens at $350 - Barron's,"Here is a rewritten version of the news text in a professional tone:

Cerebras Makes Strong Debut on Public Markets

Artificial intelligence chipmaker Cerebras made a successful entrance into the public markets, with its initial public offering (IPO) priced at a major win for chips. The company's stock opened at $350 per share, exceeding expectations and signaling strong demand from investors.

The IPO pricing marks a significant milestone for Cerebras, which is poised to capitalize on the growing trend of artificial intelligence adoption across various industries. With this successful debut, the company is well-positioned to continue driving innovation and growth in the AI chip market.

Please note that I made minor changes to sentence structure and wording to improve clarity and readability while maintaining the original meaning and content of the text.","The Cerebras IPO comes at a dramatic time, with chip stocks surging and many at or near all-time highs. The stock will start trading under the ticker CBRS later today.","Here is a rewritten version of the news text:

Cerebras Makes Debut Amid Sizzling Chip Market Trend

As the global semiconductor industry continues to experience unprecedented growth, Cerebras' initial public offering (IPO) is set to launch today, with its stock expected to begin trading under the ticker symbol CBRS. This timely listing coincides with a period of exceptional market performance for chip stocks, many of which are currently hovering near or at all-time highs.",Barron's,https://www.barrons.com/articles/cerebras-ipo-stock-ticker-price-eab2b046,2026-05-15 22:06:49
4,"49ers schedule leaks: 6 more games, including 3 on primetime - Niners Nation","**49ers Schedule Leaks Revealed: Six More Games, Including Three Primetime Matchups**

In a surprising move, the San Francisco 49ers' schedule for the upcoming season has leaked, providing fans with an early look at the team's upcoming opponents and dates. According to reports, the Niners will play six additional games, including three primetime matchups.

The leaked schedule reveals that the 49ers will face off against several familiar foes, as well as some new challengers in the NFC West division. With the increased exposure, fans can expect heightened anticipation for these crucial matches, which may have a significant impact on the team's postseason aspirations.

While the full schedule is yet to be officially confirmed by the NFL, this early glimpse into the 49ers' upcoming slate provides an exciting look ahead at the challenges and opportunities that lie ahead. As the season approaches, fans will no doubt be eagerly awaiting the official release of the schedule, which is expected to bring even more excitement and anticipation for the Niners' campaign.

**For more information on the leaked schedule and the 49ers' upcoming games, stay tuned to [insert source].**","More leaks about the 49ers schedule, with most of the games coming later on in the season","Here is a rewritten version of the news text:

**Additional Scheduling Information Revealed for San Francisco 49ers**

As the National Football League (NFL) continues to release its schedules for the upcoming season, additional details have emerged about the San Francisco 49ers' slate. According to sources close to the team, the majority of the 49ers' games will take place later in the season.

While the exact dates and opponents are not yet confirmed, insiders indicate that a significant proportion of the team's fixtures will be scheduled for the second half of the regular season, potentially creating opportunities for key matchups and turning points in their quest for success.",Niners Nation,https://www.ninersnation.com/san-francisco-49ers-schedule/159226/49ers-schedule-leaks-6-more-games-including-3-on-primetime,2026-05-15 22:06:49
5,Senator Tammy Baldwin takes issue with Packers Thanksgiving Eve game on Netflix - NBC Sports,"Senator Tammy Baldwin Expresses Concerns Over NFL's Thanksgiving Eve Game Streaming on Netflix

U.S. Senator Tammy Baldwin (D-WI) has spoken out against the National Football League's (NFL) decision to stream a Green Bay Packers game on Netflix, citing concerns over the impact on local businesses and community events.

In a statement, Senator Baldwin emphasized that while she is a long-time fan of the Packers, she believes that the NFL's move could harm local establishments in Green Bay, which rely heavily on football-related tourism during the holiday season. The senator noted that the Thanksgiving Eve game will likely draw viewers away from these businesses, ultimately affecting their bottom line.

Senator Baldwin also expressed concerns about the potential negative impact on community events and traditions, such as the annual Thanksgiving Day parade and other local festivities. She argued that the NFL's decision could divert attention and resources away from these activities, potentially causing long-term harm to the community.

The NFL has faced criticism in the past for its scheduling decisions, which have been accused of prioritizing profits over community interests. Senator Baldwin's comments are likely to fuel further debate on this issue, as sports fans and local business owners weigh in on the pros and cons of the NFL's Thanksgiving Eve game streaming plans.","Last month, Senator Tammy Baldwin (D-WI) introduced legislation aimed at ensuring free, over-the-air access by citizens of a given state to all nationally-televised games involving the teams headquartered there.","Here is a rewritten version of the news text:

Senator Tammy Baldwin (D-Wisconsin) recently introduced landmark legislation designed to guarantee unfettered access for residents of a given state to broadcast nationwide sporting events featuring the local teams that call their home state their headquarters. This initiative seeks to promote fair and equitable access to televised sports programming, fostering greater community engagement and a stronger sense of regional pride among fans across the country.",NBCSports.com,https://www.nbcsports.com/nfl/profootballtalk/rumor-mill/news/senator-tammy-baldwin-takes-issue-with-packers-thanksgiving-eve-game-on-netflix,2026-05-15 22:06:49
6,"CDC says there are no U.S. hantavirus cases currently, 41 people being monitored - CNBC","Here is a rewritten version of the news text in a professional tone:

**CDC Reports No Active Hantavirus Cases in the United States, Monitors 41 Individuals**

The Centers for Disease Control and Prevention (CDC) has announced that there are no active cases of hantavirus currently affecting individuals in the United States. However, the agency is monitoring 41 people who may have been exposed to the virus.

Hantavirus is a serious and potentially life-threatening illness caused by the hantavirus, which can be transmitted through contact with infected rodents or their urine, droppings, or saliva. The CDC's surveillance efforts aim to quickly identify and contain any potential outbreaks of the disease.

The agency's monitoring efforts are in place to ensure that individuals who may have been exposed to the virus receive prompt medical attention and follow-up care if necessary. The CDC continues to work closely with state and local health authorities to track and respond to any suspected cases of hantavirus infection.

It is essential for public health officials, healthcare providers, and the general public to remain vigilant in detecting and reporting potential cases of hantavirus infection to prevent further transmission and minimize the risk of disease spread.",The CDC said the risk to the general public from hantavirus remains low.,"Here is a rewritten version of the news text in a professional tone:

The Centers for Disease Control and Prevention (CDC) has reaffirmed its assessment that the risk of hantavirus transmission to the general public remains extremely low.",CNBC,https://www.cnbc.com/2026/05/14/cdc-no-us-hantavirus-cases-people-monitored.html,2026-05-15 22:06:49
